StoryID,StoryText,StoryNext,StoryResult,Sprite,AcvUpdate,EndingTrigger
B1_1,"드디어 중간고사도 끝났겠다 당신은 동기들과 술을 마시러 갑니다.$역시 이런 생각을 한 건 혼자만이 아니었군요. 근처 술집들은 이미 학생들로 북적이네요.$간신히 빈자리를 찾아 들어간 당신은 동기들과 즐거운 시간을 보냅니다. 잠깐, 그런데 시험은 잘 본 거예요?",b1_1,-,null,-,0
B1_2,한참 술을 마시던 당신은 점점 정신이 몽롱해지는 걸 느낍니다. 그런데 옆에서 동기가 한 잔을 더 권하는군요.,b1_2&b1_3&b1_4,-,null,-,0
B1_3,"뭐든지 과하면 안 좋은 법이죠. 당신은 다음 날 심한 숙취를 호소합니다.$어찌저찌 강의실까지 기어가긴 했지만 몰골이 말이 아닌걸요?$“{name}은 고작 중간고사 하나 끝난 걸 두고 세상이 떠나가라 술을 마셨나보군.”$교수의 비꼼에 학생들이 일제히 웃음을 터트립니다.$부끄러움은 당신의 몫. 얼굴이 빨개진 당신은 앞으로 절주하기로 마음먹습니다.$$정신력-1 , 체력-1",b1_5,정-1&체-1,null,-,0
B1_4,"당신은 수업 시간에 배운 성질 변형 마법을 사용합니다.$효과는 굉장했다!$술이 감쪽같이 물로 변했습니다.$“엄청난 녀석이 나타났다…”$“저기, 네 간의 입장도 들어봐야 하지 않을까?”$술을 물 마냥 벌컥벌컥 들이키는 당신을 보며 그 자리에 있던 동기들은 수군대기 시작합니다.$“쟤가 그렇게 술꾼이래.”$“혼자 8병을 마셨다나 봐.”$다음 날 학교 복도를 걷는 당신은 학생들의 거친 생각과 불안한 눈빛을 느낍니다.$음… 남들 눈에 어떻게 보일지 생각 좀 하고 마실 걸 그랬군요.$$정신력-1 , 체력+1",b1_5,정-1&체+1,null,-,0
B1_5,"“뭐? 술이 근손실을 일으킨다고?”$운동이 취미인 동기인데 역시 이 지점을 건드리니 반응하는군요.$이럴 때가 아니라고 생각했는지 동기는 당신을 교내 헬스장으로 끌고 가 함께 운동하는 걸 권합니다.$분명 시작은 술자리였는데 왜 끝은 운동인건지 잘 모르겠지만 좋은 게 좋은 거 아니겠어요?$당신은 몽롱했던 정신이 맑아지는 걸 느낍니다.$$정신력+1 , 체력+1",b1_5,정+1&체+1,null,-,0
B2_1,“이봐! 여기야 여기.”$교수회관의 계단을 오르던 당신에게 누군가가 말을 걸어옵니다.$소리가 난 쪽을 쳐다보니 초상화 속 인물이 당신과 눈을 마주치고 있습니다.$설마 그림이 말을 걸어온 걸까요?,b2_1&b2_2,-,null,-,0
B2_2, “쯧쯧. 교수가 시험 문제로 어떤 걸 낼지 알려주려 했는데 굴러들어온 기회를 뻥 차버리는군. 난 이 계단을 오르내리는 교수들의 말을 다 귀담아듣는다고.”$시험에서 한 문제라도 더 맞출 수 있는 기회였는데!$다음부턴 누가 부르면 대꾸라도 해주자고요. 혹시 몰라요 누가 시험 문제를 알려줄지?$$정신력-1,b2_3,정-1,null,-,0
B2_3,"“후후. 난 조지 알렉산더 피츠제럴드 4세라고 하네. 마법의 대중화에 큰 기여를 한 까닭에 이곳 사이버대학 교수회관에 내 초상화가 걸리게 되었지.”$자신이 얼마나 대단한 인물인지 온갖 자랑을 늘어놓던 조지 4세는 이내 교수들에 관한 가십도 들려줍니다.$교수들이 지나가면서 하는 얘기를 귀담아듣는다고 하는군요.$당신은 펠리시아 교수님이 교내 간사모, 즉 ‘간달프 교장선생님을 사랑하는 모임’의 회장이라는 흥미로운 사실을 알게 됩니다.$$지력+1",b2_4,지+1,null,-,0
B3_1,수업을 끝내고 나오니 다음 수업까지 한 시간 반의 여유가 있습니다.$다음 중 공강을 보내는 가장 완벽한 방법은!?,b3_1&b3_2&b3_3,-,null,-,0
B3_2,"당신은 학생식당으로 향합니다.$오늘 메뉴는…무려 HUF산 최고급 랍스터입니다! 맛있는 음식으로 허기진 배를 채우니 기분이 좋아집니다.$$정신력+1 , 체력+1",b3_4,정+1&체+1,null,-,0
B3_3,"개운한가요? 흐음, 개운하면 안 될 텐데요.$과방에서 자다 일어난 당신에게 불길함이 엄습합니다.$왜 불길한 예감은 틀리지 않는 걸까요. 시계를 보니 이미 다음 수업이 끝나고도 남은 시간입니다. 출석 비중이 큰 수업이었죠 아마?$$정신력-1 , 체력+1",b3_5,정-1&체+1,null,-,0
B3_4,"티끌이 모여 태산이 되는 법. 배운 내용을 공강 때 틈틈이 복습하면 분명 시험기간에 큰 도움이 될겁니다.$어려운 내용을 차근차근 공부하며 이해해가는 당신은 공부에 자신감이 붙습니다.$$마력+1 , 무력+1 , 지력+1",b3_4,마+1&무+1&지+1,null,-,0
B4_1,교정을 산책하는데 어디선가 고소한 냄새가 풍깁니다.$“포춘쿠키로 오늘의 운세를 알아보세요!”$가까운 곳에서 포춘쿠키 나눔 행사를 하고 있는 모양이군요.$부스에 가니 포춘쿠키가 딱 3개 남아있습니다. 어느 걸 고를까요? 오늘의 운세가 걸린 거니까 신중히 골라보자고요.,b4_1&b4_2&b4_3,-,null,-,0
B4_2,"“빛나는 지성! 오늘은 어려운 마법 주문도 술술 말할 수 있을 거예요.”$포춘쿠키 덕분인지 당신은 오늘 마법학부 샌즈 파피루스 교수의 <마법 주문의 이해> 수업에서 교수에게 좋은 인상을 주었습니다.$“{name}, 아둔한 줄 알았더니 꽤나 하는군. 이 주문을 배운 즉시 정확히 구사한 학생은 근 몇 년 만에 네가 처음이다.”$음… 악담인지 칭찬인지 분간이 잘 안 가는 말이네요. $$마력+1",b4_4,마+1,null,-,0
B4_3,“당신의 말이 곧 정답! 오늘은 어떤 말이든 설득력을 가질 거예요.”$포춘쿠키 덕분인지 당신은 오늘 관료학부 신학수 교수의 <언변은 최고의 무기> 수업에서 교수에게 좋은 인상을 주었습니다.$“{name} 학생의 뛰어난 말솜씨를 듣고 있자니 과거 검사들을 물 먹이곤 했던 내 변호사 시절이 떠오르는군요. 허허.”$그런데 당신 무슨 말을 했죠? 분명 엉덩이는 두 개라는 말을 했던 것 같은… $$무력+1,b4_4,지+1,null,-,0
B4_4,“선빵 필승! 혹시라도 싸울 일이 있다면 선빵을 날리세요.”$포춘쿠키 덕분인지 당신은 오늘 모건 퀸 교수의 <검술 대련 실습> 수업에서 교수에게 좋은 인상을 주었습니다.$“{name}은 검술 실력이 대단하군. 혹시 평소에 어떤 방식으로 연습을 하나? 나머지 학생들에게도 공유해줬으면 하는데.”$당신은 겸손을 떨며 곤란한 상황에서 빠져나옵니다. 글쎄 선빵을 날리는 게 비법이라고 말할 순 없잖아요. $$지력+1,b4_4,무+1,null,-,0
B5_1,"사물함 문틈으로 편지가 빼꼼 튀어나와 있습니다.$“이 편지는 영국에서 최초로 시작되어 일년에 한바퀴를 돌면서 받는 사람에게 행운을 주었고, 지금은 당신에게로 옮겨진 이 편지는 4일 안에 당신 곁을 떠나야 합니다.$이 편지를 포함해서 7통을 행운이 필요한 사람에게 보내 주셔야 합니다. 복사를 해도 좋습니다. 혹 미신이라 하실지 모르지만 사실입니다.”$행운의 편지군요. 잠깐 동안 러브레터인 줄 알고 기대한 거 다 알아요.$편지에는 편지의 내용을 다른 사람에게 전달하지 않으면 불운이 찾아올 거라고 적혀있습니다.",b5_1&b5_2&b5_3,-,null,-,0
B5_2,편지를 쓰레기통에 버리고 얼마 지나지 않아 길을 걷던 당신의 발에 질퍽한 무언가가 밟힙니다.$발을 들어보니…구린 냄새의 갈색 물체가 찌그러져 있습니다. 똥을 제대로 밟았네요. 행운의 편지를 무시한 대가일까요?$$정신력-1,b5_4,정-1,null,-,0
B5_3,얼마 후 당신은 복도에서 전 솔을 마주칩니다.$“{name}! 안 그래도 나한테 행운의 편지 줘서 고맙다고 말하려고 했는데. 완전 감동 받았어.”$편지를 다 읽은 게 맞냐는 당신의 질문에 전 솔은 네 줄만 읽고 말았다고 합니다.$“나는 긴 글 읽는 건 별로 안 좋아해서. 하하.”$음…전 솔이 편지를 다 안 읽은 걸 다행이라고 해야 할까요? $$고려 호감도+1,b5_5,고+1,null,-,0
B5_4,"얼마 후 당신은 복도에서 아이작을 마주칩니다.$“{name}, 안 그래도 나한테 행운의 편지를 줘서 고맙다고 말하려고 했는데 마침 잘 만났군.”$편지를 다 읽은 게 맞냐는 당신의 질문에 아이작은 네 줄만 읽고 말았다고 합니다.$“나는 중요한 문서가 아니면 네 줄 이상 읽지 않는다. 황자 신분이라 읽어야 하는 공문서가 워낙 많아야 말이지.”$음…아이작이 편지를 다 안 읽은 걸 다행이라고 해야 할까요?$$연세 호감도+1",b5_5,연+1,null,-,0
B6_1,"“안녕!”$식당에서 당신의 앞자리가 빈 순간을 누군가가 놓치지 않고 차지합니다.$민트색 머리에 아담한 키, 유오수군요.",b6_1,-,null,-,0
B6_2,"“궁금한 게 있어서.”$유오수가 눈을 반짝입니다.$”{name} 네가 학생회장 출신 설 원 선배의 신임을 받고 있고, 기사학부와 마법학부의 에이스인 전 솔과 아이작하고도 자주 어울린다는 얘기가 돌더라고.”$당신이 그랬던가요? 아무튼 얘기나 계속 들어봅시다.$“아, 스토킹 같은 걸 한 건 아니니 오해 마. 난 우리 시민의장국의 의장이신 어머니를 닮아서 마당발이거든. 여기저기서 주워들은거지.”$모르는 새에 당신 꽤나 유명인사가 됐군요? 뭐, 대단한 사람들하고 어울리는 것도 재주라면 재주죠.$“그래서 말인데, 나한테도 알려줄 수 있어? 그런 대단한 사람들하고 어울리는 비법 말이야.”$아무 생각 없는 당신과 달리 유오수는 꽤나 진지해보입니다.",b6_2&b6_3&b6_4,-,null,-,0
B6_3,"“앗, 세 사람 다 미인계를 써야 하는 쪽이야?”$유오수는 손거울을 꺼내 얼굴 이곳저곳을 비춰보더니, 이내 만족한 듯 웃음을 지어보입니다.$당신은 유오수에게 자기객관화가 안 되는 편인 것 같다고 말하려다, 그냥 입을 다물고 있기로 합니다.$괜히 일을 키워서 좋을 게 뭐가 있겠어요.$$정신력+1",b6_5,정+1,null,-,0
B6_4,유오수는 수첩을 꺼내더니 당신의 말을 받아적습니다.$“고마워. 조언 명심할게!”$유오수는 금세 떠납니다. 정말 원하는 것만 얻고 가는군요.$조언을 곧이곧대로 받아들이기 전에 눈치부터 키우면 좋을 텐데요. 본인을 두고 한 말이라는 걸 몰랐던 걸까요?,b6_6,-,null,-,0
B6_5,나는 끌려다니는 쪽이라…$“그러면 친구가 아니라 부하쯤 된다는 말이야?”$고심하는 표정의 유오수입니다.$“난 부림을 당하는 쪽보단 부리는 쪽이 되고 싶어서. 안타깝게도 그건 힘들겠네.”$유오수는 큰 도움이 되었다며 고맙다고 말합니다.$뭔가 의도와 상관없이 흘러간 느낌이 드는 건 기분탓일까요. 그나저나 이거 이상한 소문 도는 거 아니에요?$$정신력-1,b6_5,정-1,null,-,0
B8_1,"매년 열리는 대륙 최대의 마도공학 박람회는 최신 기술을 앞세운 각종 첨단기기들을 선보이는 곳으로 유명합니다.$많은 바이어들이 이곳을 방문하고 그 자리에서 판매계약이 이루어지기 때문에, 제품 시연은 매우 중요한 과제라고 할 수 있죠.$대륙의 우수한 인재들이 모인 사이버대학에서도 매년 마도공학 발명동아리가 대표로 제품을 출품하고 있습니다.$제품 시연은 사업에 능숙한 마케팅 동아리가 맡는다고 하더군요.",b8_1,-,null,-,0
B8_2,"마케팅 동아리의 일원은 아니지만, 당신은 어쩌다 보니 일일 아르바이트생으로 이곳에 와있습니다.$보수를 짭짤하게 준다는 공고를 봤는데 무시할 수 있어야 말이죠.$“예상보다 실적이 안 나오는 걸. 추가 인력까지 불러왔는데 이러면 무슨 소용이야.”$마케팅 동아리의 회장인 서해랑은 부스에 앉아 한숨을 푹푹 쉬고 있습니다.$눈을 마주치자 서해랑은 당신에게 미소를 지어 보이지만, 그 미소의 의미는…$대충 해석해보자면  ‘밥값 좀 해라 이 굼벵이야!’ 정도 되겠네요.$가만히 있으면 계속 눈칫밥을 먹일 테니 뭐라도 하는 게 좋겠군요.",b8_2&b8_3,-,null,-,0
B8_3," 마도공학 제품에 있어 무엇보다 중요한 건 성능과 편의성이죠.$뛰어난 마력, 그리고 평소 마도공학 제품을 능숙히 사용해온 경험을 바탕으로 당신은 대학생이 만든 어설픈 발명품도 그럴듯해 보이게끔 포장하는 데에 성공합니다.$삽시간에 바이어들이 부스로 모여드는군요. 마케팅. 성공적.$“{name}, 이제 보니 너 사업에 재능이 있구나? 우리 동아리…아니 우리 중앙에 꼭 필요한 인재야. 후후.”$서해랑이 당신에게 음흉한 미소를 지어 보입니다.$$마력+1 , 중앙 호감도+1",b8_4,마+1&중+1,null,-,0
B8_4,"   당신은 박람회 이곳저곳에 흩어져 있는 바이어들을 직접 찾아가 제품을 홍보합니다.$몇몇에게는 퇴짜를 맞았지만, 다행히 몇몇은 제품에 관심을 보였고 판매계약 체결을 문의해왔습니다.$아마 이리 뛰고 저리 뛰는 당신이 불쌍하게 보였겠죠.$“별로 효과적인 판촉 전략은 아니었지만 그 근성 하나만큼은 인정해줄게.”$서해랑은 박람회장을 한 바퀴 돌고 오느라 지친 당신의 어깨를 토닥이며 말합니다.$고생이란 고생은 다 했지만 그만한 보람이 있어 다행이군요.$$체력-1 , 무력+1",b8_5,체-1&무+1,null,-,0
B9_1,"방금 전 발표 수업을 마친 당신은 굉장히! 엄청난! 갈증을 느낍니다. 저기 음료 자판기에서 반드시! 뭔가를 사야겠는데요?$자판기 앞에 서서 주머니를 뒤적거리…거리…$저런, 지갑이 없군요. 있어도 크게 다를 건 없어보이지만요.$지나가는 사람한테 돈 구걸이라도 해봐요. 당신은 반드시! 음료를 사야하니까요?",b9_1&b9_2&b9_3,-,null,-,0
B9_2,“뭐? 그까짓 자판기 음료 하나 당연히 사줄 수 있지.”$유오수는 지갑에서 카드를 꺼내더니 자신만만하게 결제를 시도합니다.$“잔액 부족.”$“…”$“잔액 부족.”$“이럴 순 없어! 분명 기계에 문제가 있는거야!”$당신은 음료 자판기와 실랑이를 벌이는 유오수를 두고 현장을 빠져나옵니다. ,b9_4,-,null,-,0
B9_3,"""그럼, 민회의 정이 있지.""$이재희는 싱긋 웃으면서 당신에게 무언가를 내밉니다.$장부처럼 보이는 책이군요. 표지에는 '사이버대학 민회 회계장부'라는 제목이 쓰여있습니다.$두께가 상당한 걸 보니 어림잡아 3년치 정도는 되겠어요.$“디지털 아카이빙의 일환으로 최근 10년치 민회 자료를 모두 클라우드로 옮기고 있거든. 자판기 음료 하나에 일을 도와준다니 너무 기쁜 걸?”$사람들이 정이 참 무섭다는 말을 괜히 하는 게 아니군요.$정말 무섭네요…$$성균관 호감도+1",b9_4,성+1,null,-,0
B9_4,"“왜 자판기 음료를 사먹어? 차라리 카페를 가지.”$서해랑은 당신을 데리고 인근 카페로 갑니다.$“시즌 한정 음료가 그렇게 맛있다고 하더라고.”$당신은 서해랑의 추천에 따라 시즌 한정 음료를 선택합니다.$이해타산적인 성격의 서해랑이 이런 호의를 베풀다니, 무슨 속셈이라도 있는 걸까요?$“시즌 한정 음료는 구매하면 스탬프 적립이 2배란 말이지. 후후.”$스탬프 용지에 찍힌 스탬프 2개를 보며 만족스러운 미소를 짓는 서해랑입니다.$“아, 그리고 나중에 돈 입금은…”$뭐죠? 누가 봐도 호의를 베푸는 모양새였는데 말이에요.$돈은 돈대로 받고 카페 스탬프 2개까지 챙기다니…!$역시 타고난 장사꾼 기질은 어디 안 가는군요. $$중앙 호감도+1",b9_4,중+1,null,-,0
